{
  "date": "2026-02-18",
  "generated_at": "2026-02-18T11:30:00",
  "last_updated": "2026-02-18T21:06:00",
  "stocks": {
    "CVNA": {
      "ticker": "CVNA",
      "company": "Carvana Co.",
      "sector": "Consumer Discretionary",
      "earnings_date": "2026-02-18",
      "earnings_time": "AMC",
      "grade": "C-",
      "total_score": 60,
      "expected_move": 12.5,
      "safety_margin_2x": 25.0,
      "grade_components": {
        "earnings_predictability": {
          "score": 18,
          "max": 30,
          "reason": "Volatile earnings history with mixed beats/misses. Q4 FY26: -$0.15 vs -$0.22 YoY improvement but still negative. Turnaround story in progress."
        },
        "downside_em_respect": {
          "score": 5,
          "max": 25,
          "respect_1x_down": {"rate": 60, "description": "40% of misses exceeded 1x EM to downside"},
          "respect_1_5x_down": {"rate": 75, "description": "25% of misses exceeded 1.5x EM - drops hard when misses"},
          "respect_2x_down": {"rate": 75, "description": "25% of misses exceeded 2x EM - extreme assignment risk"},
          "reason": "1.5x down: 0pts (75%). 2x down: 0pts (75%). 1x down: 1pt (60%). Historical: 0pts. Total: 5/25."
        },
        "assignment_desirability": {
          "score": 15,
          "max": 20,
          "reason": "Would own at $45-50 for speculative recovery play. High debt load but improving unit economics."
        },
        "premium_yield": {
          "score": 17,
          "max": 20,
          "reason": "12.5% EM = high IV. ATM weekly puts yielding $5.50-6.00 premium. IV rank at 65% - elevated."
        },
        "binary_risk": {
          "score": 5,
          "max": 0,
          "reason": "Used car market cyclicality, interest rate sensitivity, debt refinancing risk."
        }
      },
      "key_insight": "Expected move elevated due to: 1) High short interest creating squeeze potential, 2) Debt restructuring progress being closely watched, 3) Used car price volatility driving uncertainty. Premium attractive but assignment risk higher.",
      "historical_em": 10.2,
      "trade_setup": {
        "strategy": "Put credit spread",
        "strikes": "Sell $45p/Buy $40p",
        "premium_target": "$1.80 credit",
        "expiration": "February 28, 2026",
        "annualized_return": "~52%"
      },
      "risk_factors": [
        {
          "risk": "Used car price decline",
          "impact": "Inventory valuation write-downs \u2192 Margin pressure",
          "probability": "Medium"
        },
        {
          "risk": "Interest rate sensitivity",
          "impact": "Financing costs rising \u2192 Customer affordability issues",
          "probability": "High"
        }
      ],
      "bottom_line": "High premium yield but elevated risk. Suitable for risk-tolerant premium sellers with defined risk strategies.",
      "last_analyzed": "2026-02-18T11:30:00",
      "recommendation": "Trade with caution"
    },
    "DASH": {
      "ticker": "DASH",
      "company": "DoorDash Inc.",
      "sector": "Consumer Discretionary",
      "earnings_date": "2026-02-18",
      "earnings_time": "AMC",
      "grade": "C",
      "total_score": 66,
      "expected_move": 8.2,
      "safety_margin_2x": 16.4,
      "grade_components": {
        "earnings_predictability": {
          "score": 16,
          "max": 30,
          "reason": "Mixed earnings history with recent beats but guidance volatility. Q4 FY26: $0.42 vs $0.38 YoY (+10.5%). Growth decelerating."
        },
        "downside_em_respect": {
          "score": 16,
          "max": 25,
          "respect_1x_down": {"rate": 75, "description": "25% of misses exceeded 1x EM to downside"},
          "respect_1_5x_down": {"rate": 90, "description": "10% of misses exceeded 1.5x EM - moderate downside risk"},
          "respect_2x_down": {"rate": 95, "description": "5% of misses exceeded 2x EM - low extreme assignment risk"},
          "reason": "1.5x down: 9pts (90%). 2x down: 3pts (95%). 1x down: 2pts (75%). Historical: 2pts. Total: 16/25."
        },
        "assignment_desirability": {
          "score": 12,
          "max": 20,
          "reason": "Would own at $95-100 for growth exposure. Market leader but facing regulatory and competitive pressures."
        },
        "premium_yield": {
          "score": 17,
          "max": 20,
          "reason": "8.2% EM = moderate IV. ATM weekly puts yielding $3.80-4.20 premium. IV rank at 55% - above average."
        },
        "binary_risk": {
          "score": 5,
          "max": 0,
          "reason": "Regulatory risk (worker classification), competition from Uber Eats, margin pressure from restaurant partnerships."
        }
      },
      "key_insight": "Expected move slightly above historical average due to: 1) Regulatory uncertainty around gig worker status, 2) International expansion execution risk, 3) Restaurant partnership renegotiations creating volatility.",
      "historical_em": 7.5,
      "trade_setup": {
        "strategy": "Iron condor",
        "strikes": "Sell $100c/Buy $105c, Sell $90p/Buy $85p",
        "premium_target": "$2.20 credit",
        "expiration": "February 28, 2026",
        "annualized_return": "~42%"
      },
      "risk_factors": [
        {
          "risk": "Regulatory changes",
          "impact": "Worker reclassification \u2192 Cost structure disruption",
          "probability": "Medium-High"
        },
        {
          "risk": "Competition intensification",
          "impact": "Price wars \u2192 Margin compression",
          "probability": "Medium"
        }
      ],
      "bottom_line": "Moderate premium yield with elevated regulatory risk. Best for defined risk strategies with wider wings.",
      "last_analyzed": "2026-02-18T11:30:00",
      "recommendation": "Trade with defined risk"
    },
    "EBAY": {
      "ticker": "EBAY",
      "company": "eBay Inc.",
      "sector": "Consumer Discretionary",
      "earnings_date": "2026-02-18",
      "earnings_time": "AMC",
      "grade": "B",
      "total_score": 81,
      "expected_move": 6.8,
      "safety_margin_2x": 13.6,
      "grade_components": {
        "earnings_predictability": {
          "score": 24,
          "max": 30,
          "reason": "Consistent beats with stable guidance. Q4 FY26: $1.12 vs $1.05 YoY (+6.7%). Mature business with predictable cash flows."
        },
        "downside_em_respect": {
          "score": 22,
          "max": 25,
          "respect_1x_down": {"rate": 85, "description": "15% of misses exceeded 1x EM to downside"},
          "respect_1_5x_down": {"rate": 98, "description": "2% of misses exceeded 1.5x EM - very low downside risk"},
          "respect_2x_down": {"rate": 100, "description": "0% of misses exceeded 2x EM - no extreme assignment risk"},
          "reason": "1.5x down: 12pts (98%). 2x down: 5pts (100%). 1x down: 3pts (85%). Historical: 2pts. Total: 22/25."
        },
        "assignment_desirability": {
          "score": 16,
          "max": 20,
          "reason": "Would own at $48-52 for value/dividend play. Strong balance sheet, shareholder returns via buybacks."
        },
        "premium_yield": {
          "score": 14,
          "max": 20,
          "reason": "6.8% EM = moderate IV. ATM weekly puts yielding $1.60-1.90 premium. IV rank at 40% - average."
        },
        "binary_risk": {
          "score": 5,
          "max": 0,
          "reason": "Marketplace competition from Amazon, growth stagnation, but diversified revenue streams provide stability."
        }
      },
      "key_insight": "Expected move modestly elevated due to: 1) Focused categories strategy showing mixed results, 2) Authentication services growth trajectory uncertainty, 3) Advertising revenue becoming larger portion of mix.",
      "historical_em": 5.9,
      "trade_setup": {
        "strategy": "Iron condor",
        "strikes": "Sell $52c/Buy $55c, Sell $48p/Buy $45p",
        "premium_target": "$1.40 credit",
        "expiration": "February 28, 2026",
        "annualized_return": "~38%"
      },
      "risk_factors": [
        {
          "risk": "Growth stagnation",
          "impact": "Marketplace GMV decline \u2192 Revenue pressure",
          "probability": "Medium"
        },
        {
          "risk": "Competition intensification",
          "impact": "Specialty verticals facing niche competitors",
          "probability": "Low-Medium"
        }
      ],
      "bottom_line": "Solid premium collection candidate with lower volatility. Good for conservative income strategies.",
      "last_analyzed": "2026-02-18T11:30:00",
      "recommendation": "Trade"
    },
    "RELY": {
      "ticker": "RELY",
      "company": "Remitly Global Inc.",
      "sector": "Financials",
      "earnings_date": "2026-02-18",
      "earnings_time": "AMC",
      "grade": "C+",
      "total_score": 67,
      "expected_move": 9.5,
      "safety_margin_2x": 19.0,
      "grade_components": {
        "earnings_predictability": {
          "score": 20,
          "max": 30,
          "reason": "Growing fintech with improving beat consistency. Q4 FY26: $0.08 vs $0.03 YoY (+166%). Strong customer growth driving scale."
        },
        "downside_em_respect": {
          "score": 10,
          "max": 25,
          "respect_1x_down": {"rate": 70, "description": "30% of misses exceeded 1x EM to downside"},
          "respect_1_5x_down": {"rate": 85, "description": "15% of misses exceeded 1.5x EM - moderate downside risk"},
          "respect_2x_down": {"rate": 92, "description": "8% of misses exceeded 2x EM - low extreme assignment risk"},
          "reason": "1.5x down: 6pts (85%). 2x down: 0pts (92%). 1x down: 2pts (70%). Historical: 2pts. Total: 10/25."
        },
        "assignment_desirability": {
          "score": 15,
          "max": 20,
          "reason": "Would own at $22-25 for growth fintech exposure. Digital remittance leader with international expansion potential."
        },